{
  "schemaVersion": "ai-decision-checkpoint-v1",
  "checkpointId": "cp-7bfe-01-central-before-finite-economy",
  "source": {
    "kind": "captured_match",
    "findingId": "CP-7BFE-01",
    "capturedAt": "2026-07-12T21:00:54.951Z",
    "matchId": "match_7bfe82501d0fdcb8",
    "decisionIndex": 9,
    "stateVersion": 17
  },
  "compatibility": {
    "engineSchemaVersion": "0.99.0",
    "aiRuntimeCheckpointVersion": "ai-runtime-checkpoint-v1"
  },
  "actor": "corp",
  "difficulty": "hard",
  "profileId": "corp-ai-v0.9-hard",
  "deckSnapshot": {
    "deckSnapshotId": "fnv1a:1e1a582e:corp",
    "sourceDeckId": "Manhunt Pressure Bureau",
    "side": "corp",
    "cardPoolSnapshotId": "card-snapshot-0.8",
    "formatProfileId": "netgrid_private_local_classic_proteus_playtest_v1",
    "deckHash": "fnv1a:1e1a582e",
    "cards": [
      {
        "cardId": "onr_v1_196_corporate-war",
        "quantity": 3
      },
      {
        "cardId": "onr_v1_223_banpei",
        "quantity": 2
      },
      {
        "cardId": "onr_v1_237_data-wall",
        "quantity": 3
      },
      {
        "cardId": "onr_v1_244_filter",
        "quantity": 3
      },
      {
        "cardId": "onr_v1_252_keeper",
        "quantity": 2
      },
      {
        "cardId": "onr_v1_261_quandary",
        "quantity": 3
      },
      {
        "cardId": "onr_v1_275_vacuum-link",
        "quantity": 2
      },
      {
        "cardId": "onr_v1_279_wall-of-static",
        "quantity": 2
      },
      {
        "cardId": "onr_v1_283_audit-of-call-records",
        "quantity": 3
      },
      {
        "cardId": "onr_v1_284_chance-observation",
        "quantity": 3
      },
      {
        "cardId": "onr_v1_285_closed-accounts",
        "quantity": 3
      },
      {
        "cardId": "onr_v1_299_power-grid-overload",
        "quantity": 1
      },
      {
        "cardId": "onr_v1_302_scorched-earth",
        "quantity": 3
      },
      {
        "cardId": "onr_v1_304_systematic-layoffs",
        "quantity": 3
      },
      {
        "cardId": "onr_v1_307_urban-renewal",
        "quantity": 3
      },
      {
        "cardId": "onr_v1_309_bbs-whispering-campaign",
        "quantity": 3
      },
      {
        "cardId": "onr_v1_313_city-surveillance",
        "quantity": 2
      },
      {
        "cardId": "onr_v1_327_i-got-a-rock",
        "quantity": 1
      }
    ]
  },
  "engine": {
    "stateVersion": 17,
    "stateHash": "fnv1a:7c0c8a6e",
    "testOnlyGameState": {
      "matchId": "match_7bfe82501d0fdcb8",
      "baseline": {
        "rulesVersion": "26.03",
        "cardTextSource": "manual",
        "cardTextSnapshotId": "mvp-0.99-demo",
        "engineSchemaVersion": "0.99.0",
        "cardImplementationVersion": "0.99.0",
        "deviationRegistryVersion": "0.99.0",
        "playerViewSchemaVersion": "0.99.0",
        "multiplayerSchemaVersion": "0.99.0",
        "aiControllerSchemaVersion": "0.99.0",
        "simulationSchemaVersion": "0.99.0"
      },
      "stateVersion": 17,
      "seed": "match-mrhz08pv-pbn1s2:series-game-2",
      "randomCounter": 98,
      "randomDrawRecords": [
        {
          "counter": 0,
          "purpose": "setup.shuffle.runner.start_stack",
          "value": 0.024662515857591716
        },
        {
          "counter": 1,
          "purpose": "setup.shuffle.runner.start_stack",
          "value": 0.7616702399691404
        },
        {
          "counter": 2,
          "purpose": "setup.shuffle.runner.start_stack",
          "value": 0.58720635056329
        },
        {
          "counter": 3,
          "purpose": "setup.shuffle.runner.start_stack",
          "value": 0.9441176096562766
        },
        {
          "counter": 4,
          "purpose": "setup.shuffle.runner.start_stack",
          "value": 0.3860297341049287
        },
        {
          "counter": 5,
          "purpose": "setup.shuffle.runner.start_stack",
          "value": 0.17994052455718934
        },
        {
          "counter": 6,
          "purpose": "setup.shuffle.runner.start_stack",
          "value": 0.8408320303793837
        },
        {
          "counter": 7,
          "purpose": "setup.shuffle.runner.start_stack",
          "value": 0.841072375689586
        },
        {
          "counter": 8,
          "purpose": "setup.shuffle.runner.start_stack",
          "value": 0.41459913385624836
        },
        {
          "counter": 9,
          "purpose": "setup.shuffle.runner.start_stack",
          "value": 0.4252835886298443
        },
        {
          "counter": 10,
          "purpose": "setup.shuffle.runner.start_stack",
          "value": 0.9118227769885402
        },
        {
          "counter": 11,
          "purpose": "setup.shuffle.runner.start_stack",
          "value": 0.7744540094982253
        },
        {
          "counter": 12,
          "purpose": "setup.shuffle.runner.start_stack",
          "value": 0.24257834564888825
        },
        {
          "counter": 13,
          "purpose": "setup.shuffle.runner.start_stack",
          "value": 0.23335956882418551
        },
        {
          "counter": 14,
          "purpose": "setup.shuffle.runner.start_stack",
          "value": 0.09402636959983057
        },
        {
          "counter": 15,
          "purpose": "setup.shuffle.runner.start_stack",
          "value": 0.7995776773781565
        },
        {
          "counter": 16,
          "purpose": "setup.shuffle.runner.start_stack",
          "value": 0.23286495123520123
        },
        {
          "counter": 17,
          "purpose": "setup.shuffle.runner.start_stack",
          "value": 0.7703616553505281
        },
        {
          "counter": 18,
          "purpose": "setup.shuffle.runner.start_stack",
          "value": 0.9808744861596648
        },
        {
          "counter": 19,
          "purpose": "setup.shuffle.runner.start_stack",
          "value": 0.24327765853711836
        },
        {
          "counter": 20,
          "purpose": "setup.shuffle.runner.start_stack",
          "value": 0.7017095552396911
        },
        {
          "counter": 21,
          "purpose": "setup.shuffle.runner.start_stack",
          "value": 0.36136307157436587
        },
        {
          "counter": 22,
          "purpose": "setup.shuffle.runner.start_stack",
          "value": 0.21038609595225521
        },
        {
          "counter": 23,
          "purpose": "setup.shuffle.runner.start_stack",
          "value": 0.7127253487200153
        },
        {
          "counter": 24,
          "purpose": "setup.shuffle.runner.start_stack",
          "value": 0.25977591472508665
        },
        {
          "counter": 25,
          "purpose": "setup.shuffle.runner.start_stack",
          "value": 0.9627745195987024
        },
        {
          "counter": 26,
          "purpose": "setup.shuffle.runner.start_stack",
          "value": 0.7870831761999385
        },
        {
          "counter": 27,
          "purpose": "setup.shuffle.runner.start_stack",
          "value": 0.8993093970348537
        },
        {
          "counter": 28,
          "purpose": "setup.shuffle.runner.start_stack",
          "value": 0.31524596000488847
        },
        {
          "counter": 29,
          "purpose": "setup.shuffle.runner.start_stack",
          "value": 0.149557980025933
        },
        {
          "counter": 30,
          "purpose": "setup.shuffle.runner.start_stack",
          "value": 0.673296660369828
        },
        {
          "counter": 31,
          "purpose": "setup.shuffle.runner.start_stack",
          "value": 0.7403266748656165
        },
        {
          "counter": 32,
          "purpose": "setup.shuffle.runner.start_stack",
          "value": 0.9852897436356205
        },
        {
          "counter": 33,
          "purpose": "setup.shuffle.runner.start_stack",
          "value": 0.9126732691709276
        },
        {
          "counter": 34,
          "purpose": "setup.shuffle.runner.start_stack",
          "value": 0.9033936267941712
        },
        {
          "counter": 35,
          "purpose": "setup.shuffle.runner.start_stack",
          "value": 0.7487781655840523
        },
        {
          "counter": 36,
          "purpose": "setup.shuffle.runner.start_stack",
          "value": 0.7161578943331552
        },
        {
          "counter": 37,
          "purpose": "setup.shuffle.runner.start_stack",
          "value": 0.36508361132948886
        },
        {
          "counter": 38,
          "purpose": "setup.shuffle.runner.start_stack",
          "value": 0.5565815132689355
        },
        {
          "counter": 39,
          "purpose": "setup.shuffle.runner.start_stack",
          "value": 0.7307951534356206
        },
        {
          "counter": 40,
          "purpose": "setup.shuffle.runner.start_stack",
          "value": 0.610522338470896
        },
        {
          "counter": 41,
          "purpose": "setup.shuffle.runner.start_stack",
          "value": 0.6320183320639005
        },
        {
          "counter": 42,
          "purpose": "setup.shuffle.runner.start_stack",
          "value": 0.7635393220664342
        },
        {
          "counter": 43,
          "purpose": "setup.shuffle.runner.start_stack",
          "value": 0.26387638593852103
        },
        {
          "counter": 44,
          "purpose": "setup.shuffle.corp.start_rnd",
          "value": 0.7638394103476759
        },
        {
          "counter": 45,
          "purpose": "setup.shuffle.corp.start_rnd",
          "value": 0.496453348921158
        },
        {
          "counter": 46,
          "purpose": "setup.shuffle.corp.start_rnd",
          "value": 0.5488549948919437
        },
        {
          "counter": 47,
          "purpose": "setup.shuffle.corp.start_rnd",
          "value": 0.6998582999497088
        },
        {
          "counter": 48,
          "purpose": "setup.shuffle.corp.start_rnd",
          "value": 0.36472008214465146